user_name,user_url,comment
乌拉儿,http://p4.music.126.net/UISF4uOBKHBXgjJErAV6Zw==/109951163456775199.jpg,这首在专辑里我想是唯一带着些许小伤感基调的歌。就像在漫步在夜色降临的街道，路灯一个接一个悠悠地亮起，在商店买了两瓶苏打果汁，俩人一路无话，只享受着仅剩youth时光，约定好从此以后两人一直都不要变，毕竟我们两个都还不是大人。僕ら、まだ
Stella_阿森色,http://p3.music.126.net/g_M_icFjM5UUmh2JuajssA==/109951164312743195.jpg,像这种日系穿插大合唱的歌还有吗，上次惊艳到是天气之子的插曲
lynnette_C,http://p3.music.126.net/hic_DoYrvEJ8PUxCduI4nA==/109951164861798973.jpg,网易更新了功能，我看到自己听了221次这首歌[惊恐][惊恐][惊恐]
_3o3-,http://p4.music.126.net/MOk-q02KE7Lg6c_anjfNWw==/109951168026867854.jpg,Reol看到原曲收费于是立马上传了第二首
HlQl,http://p3.music.126.net/Ndol00lUn-bOd0TDe1dRGQ==/109951168091077616.jpg,第130，发现了宝藏。日推的右边集合！
